{"town":"BUKIT TIMAH","from":"2024-11","to":"2026-10","columns":["month","block","street_name","flat_type","flat_model","storey_lo","storey_hi","floor_area_sqm","lease_commence_year","resale_price"],"rows":[["2026-10","8","EMPRESS RD","3 ROOM","Improved",4,6,65,1976,548888],["2026-10","2","QUEEN'S RD","4 ROOM","Improved",4,6,89,1974,650000],["2026-10","3","TOH YI DR","EXECUTIVE","Maisonette",1,3,146,1988,1375000],["2026-09","5","FARRER RD","5 ROOM","Standard",13,15,123,1974,1045000],["2026-09","4","QUEEN'S RD","3 ROOM","Improved",10,12,73,1974,480000],["2026-09","14","TOH YI DR","5 ROOM","Improved",4,6,122,1988,980000],["2026-09","17","TOH YI DR","5 ROOM","Improved",4,6,122,1988,1300000],["2026-09","2","TOH YI DR","EXECUTIVE","Maisonette",7,9,146,1988,1420000],["2026-09","2","TOH YI DR","EXECUTIVE","Maisonette",1,3,154,1988,1310000],["2026-09","4","TOH YI DR","4 ROOM","Model A",4,6,104,1988,930000],["2026-09","8","TOH YI DR","EXECUTIVE","Maisonette",1,3,146,1989,1400000],["2026-08","8","EMPRESS RD","3 ROOM","Improved",13,15,65,1976,455000],["2026-08","4","TOH YI DR","4 ROOM","Model A",13,15,104,1988,978000],["2026-08","4","TOH YI DR","4 ROOM","Model A",10,12,104,1988,955000],["2026-08","5","TOH YI DR","5 ROOM","Improved",10,12,122,1989,1233000],["2026-07","1","QUEEN'S RD","5 ROOM","Standard",16,18,123,1974,1020000],["2026-07","16","TOH YI DR","5 ROOM","Improved",10,12,122,1988,1225000],["2026-07","5","TOH YI DR","5 ROOM","Improved",7,9,127,1989,1300000],["2026-07","5","TOH YI DR","4 ROOM","Model A",7,9,104,1989,938000],["2026-06","8","EMPRESS RD","3 ROOM","Improved",10,12,65,1976,500000],["2026-06","5","FARRER RD","5 ROOM","Standard",16,18,123,1974,1040000],["2026-06","1","QUEEN'S RD","5 ROOM","Standard",4,6,123,1974,925000],["2026-06","2","QUEEN'S RD","4 ROOM","Improved",10,12,89,1974,680000],["2026-06","17","TOH YI DR","5 ROOM","Improved",4,6,128,1988,1050000],["2026-06","3","TOH YI DR","EXECUTIVE","Maisonette",10,12,150,1988,1508888],["2026-06","3","TOH YI DR","EXECUTIVE","Maisonette",1,3,146,1988,1330000],["2026-06","5","TOH YI DR","4 ROOM","Model A",10,12,104,1989,925000],["2026-06","9","TOH YI DR","5 ROOM","Improved",10,12,127,1989,1280000],["2026-05","13","TOH YI DR","4 ROOM","Model A",4,6,104,1988,920000],["2026-05","13","TOH YI DR","5 ROOM","Improved",1,3,122,1988,1150000],["2026-04","5","FARRER RD","5 ROOM","Standard",19,21,120,1974,1020000],["2026-04","3","QUEEN'S RD","3 ROOM","Improved",10,12,76,1974,545000],["2026-04","11","TOH YI DR","4 ROOM","Model A",7,9,108,1989,920000],["2026-04","13","TOH YI DR","4 ROOM","Model A",7,9,104,1988,963000],["2026-04","14","TOH YI DR","4 ROOM","Model A",7,9,104,1988,950000],["2026-04","5","TOH YI DR","5 ROOM","Improved",7,9,122,1989,1100000],["2026-03","11","TOH YI DR","5 ROOM","Improved",1,3,122,1989,1020000],["2026-03","14","TOH YI DR","4 ROOM","Model A",7,9,104,1988,910000],["2026-03","14","TOH YI DR","4 ROOM","Model A",7,9,104,1988,968000],["2026-03","16","TOH YI DR","5 ROOM","Improved",7,9,122,1988,1200000],["2026-03","3","TOH YI DR","EXECUTIVE","Maisonette",1,3,146,1988,1350000],["2026-03","4","TOH YI DR","5 ROOM","Improved",7,9,122,1988,1118000],["2026-03","6","TOH YI DR","EXECUTIVE","Maisonette",4,6,146,1989,1428000],["2026-02","4","QUEEN'S RD","3 ROOM","Improved",4,6,73,1974,460000],["2026-02","11","TOH YI DR","5 ROOM","Improved",7,9,122,1989,1115000],["2026-01","8","EMPRESS RD","3 ROOM","Improved",7,9,65,1976,445000],["2026-01","4","QUEEN'S RD","3 ROOM","Improved",10,12,63,1974,475000],["2026-01","14","TOH YI DR","4 ROOM","Model A",13,15,104,1988,970000],["2026-01","5","TOH YI DR","5 ROOM","Improved",7,9,128,1989,1188000],["2025-12","1","QUEEN'S RD","5 ROOM","Standard",7,9,120,1974,990000],["2025-12","4","QUEEN'S RD","3 ROOM","Improved",10,12,73,1974,560000],["2025-12","1","TOH YI DR","4 ROOM","Model A",4,6,104,1988,908000],["2025-12","4","TOH YI DR","4 ROOM","Model A",4,6,104,1988,938000],["2025-12","7","TOH YI DR","EXECUTIVE","Apartment",7,9,142,1989,1390000],["2025-11","8","EMPRESS RD","3 ROOM","Improved",7,9,65,1976,523000],["2025-11","5","FARRER RD","5 ROOM","Standard",13,15,123,1974,1000000],["2025-11","12","TOH YI DR","5 ROOM","Improved",7,9,122,1989,1222888],["2025-11","13","TOH YI DR","4 ROOM","Model A",4,6,104,1988,960888],["2025-11","13","TOH YI DR","5 ROOM","Improved",4,6,128,1988,1240000],["2025-11","15","TOH YI DR","EXECUTIVE","Maisonette",1,3,145,1988,1288000],["2025-11","4","TOH YI DR","5 ROOM","Improved",1,3,122,1988,1030000],["2025-09","6","FARRER RD","4 ROOM","Improved",1,3,91,1974,620000],["2025-09","2","QUEEN'S RD","4 ROOM","Improved",7,9,89,1974,660000],["2025-09","3","QUEEN'S RD","4 ROOM","Improved",10,12,91,1974,670000],["2025-09","4","QUEEN'S RD","3 ROOM","Improved",10,12,63,1974,488000],["2025-09","4","QUEEN'S RD","3 ROOM","Improved",10,12,73,1974,495000],["2025-09","15","TOH YI DR","EXECUTIVE","Maisonette",1,3,146,1988,1340000],["2025-08","8","EMPRESS RD","3 ROOM","Improved",10,12,65,1976,460000],["2025-08","3","QUEEN'S RD","4 ROOM","Improved",10,12,91,1974,638000],["2025-08","14","TOH YI DR","5 ROOM","Improved",7,9,122,1988,1178888],["2025-08","17","TOH YI DR","5 ROOM","Improved",10,12,122,1988,1270000],["2025-08","2","TOH YI DR","EXECUTIVE","Maisonette",10,12,150,1988,1455000],["2025-07","8","EMPRESS RD","3 ROOM","Improved",10,12,65,1976,438000],["2025-07","11","TOH YI DR","5 ROOM","Improved",1,3,122,1989,1020000],["2025-07","11","TOH YI DR","5 ROOM","Improved",10,12,122,1989,1190000],["2025-07","16","TOH YI DR","4 ROOM","Model A",7,9,104,1988,953000],["2025-07","17","TOH YI DR","5 ROOM","Improved",7,9,128,1988,1220000],["2025-06","1","TOH YI DR","5 ROOM","Improved",13,15,122,1988,1280000],["2025-06","7","TOH YI DR","EXECUTIVE","Maisonette",1,3,146,1989,1310000],["2025-05","15","TOH YI DR","EXECUTIVE","Maisonette",1,3,146,1988,1290000],["2025-05","16","TOH YI DR","5 ROOM","Improved",7,9,122,1988,1190000],["2025-05","3","TOH YI DR","EXECUTIVE","Maisonette",7,9,154,1988,1501555],["2025-05","4","TOH YI DR","4 ROOM","Model A",13,15,104,1988,920342],["2025-05","5","TOH YI DR","5 ROOM","Improved",1,3,122,1989,1050000],["2025-05","5","TOH YI DR","5 ROOM","Improved",10,12,122,1989,1230000],["2025-05","9","TOH YI DR","4 ROOM","Model A",7,9,104,1989,966555],["2025-04","19","TOH YI DR","3 ROOM","Simplified",1,3,64,1988,600000],["2025-04","6","TOH YI DR","EXECUTIVE","Maisonette",7,9,150,1989,1418000],["2025-03","1","QUEEN'S RD","5 ROOM","Standard",7,9,125,1974,965000],["2025-03","1","QUEEN'S RD","5 ROOM","Standard",4,6,120,1974,900888],["2025-03","1","QUEEN'S RD","5 ROOM","Standard",13,15,123,1974,990000],["2025-03","3","QUEEN'S RD","4 ROOM","Improved",7,9,91,1974,625000],["2025-03","4","QUEEN'S RD","3 ROOM","Improved",7,9,73,1974,500000],["2025-03","13","TOH YI DR","4 ROOM","Model A",7,9,104,1988,960888],["2025-02","8","EMPRESS RD","3 ROOM","Improved",10,12,65,1976,458888],["2025-02","13","TOH YI DR","5 ROOM","Improved",7,9,122,1988,1260000],["2025-02","17","TOH YI DR","4 ROOM","Model A",13,15,104,1988,930000],["2025-02","17","TOH YI DR","4 ROOM","Model A",13,15,104,1988,850000],["2025-02","2","TOH YI DR","EXECUTIVE","Maisonette",10,12,146,1988,1460000],["2025-01","16","TOH YI DR","4 ROOM","Model A",1,3,104,1988,750000],["2025-01","16","TOH YI DR","4 ROOM","Model A",7,9,104,1988,920000],["2025-01","19","TOH YI DR","3 ROOM","Simplified",4,6,64,1988,602888],["2025-01","4","TOH YI DR","4 ROOM","Model A",10,12,104,1988,960000],["2024-12","13","TOH YI DR","4 ROOM","Model A",10,12,104,1988,920000],["2024-12","4","TOH YI DR","4 ROOM","Model A",4,6,104,1988,871888],["2024-11","8","EMPRESS RD","3 ROOM","Improved",10,12,65,1976,480000],["2024-11","3","QUEEN'S RD","4 ROOM","Improved",4,6,91,1974,550000],["2024-11","16","TOH YI DR","5 ROOM","Improved",7,9,122,1988,1110000],["2024-11","5","TOH YI DR","4 ROOM","Model A",4,6,104,1989,860000]]}